{
  "event_id": "evt_01J8ZK9",
  "event_type": "contact-message.created",
  "event_version": "v1",
  "occurred_at": "2026-06-23T17:30:00Z",
  "producer": "auth-service",
  "tenant_id": null,
  "correlation_id": "corr_01J8ZK9",
  "trace_id": null,
  "data": {
    "contact_message_id": 1,
    "email": "cliente@example.com",
    "company": "Empresa Demo",
    "created_at": "2026-06-23T17:30:00Z"
  }
}
